code,description,rvu,fud,pctc_split,is_addon,is_mod51_exempt,is_state_specific,is_altered_cpt,is_br
94015,"Patient-initiated spirometric recording per 30-day period of time; recording (includes hook-up, reinforced education, data transmission, data capture, trend analysis, and periodic recalibration)",5.92,XXX,0/100,False,False,False,False,False
94016,Patient-initiated spirometric recording per 30-day period of time; review and inter- pretation only by a physician or other qualified health care professional,7.44,XXX,,False,False,False,False,False
94060,"Bronchodilation responsiveness, spirometry as in 94010, pre- and post-bronchodi- lator administration",13.11,XXX,40/60,False,False,False,False,False
94070,"Bronchospasm provocation evaluation, multiple spirometric determinations as in 94010, with administered agents (eg, antigen[s], cold air, methacholine)",27.06,XXX,40/60,False,False,False,False,False
94150,"Vital capacity, total (separate procedure)",2.79,XXX,40/60,False,False,False,False,False
94200,"Maximum breathing capacity, maximal voluntary ventilation",6.59,XXX,20/80,False,False,False,False,False
94250,"Expired gas collection, quantitative, single procedure (separate procedure)",2.54,XXX,20/80,False,False,False,False,False
94375,Respiratory flow volume loop,10.15,XXX,20/80,False,False,False,False,False
94400,Breathing response to CO2 (CO2 response curve),20.29,XXX,20/80,False,False,False,False,False
94450,Breathing response to hypoxia (hypoxia response curve),16.23,XXX,20/80,False,False,False,False,False
94452,"High altitude simulation test (HAST), with interpretation and report by a physician or other qualified health care professional;",20.46,XXX,30/70,False,False,False,False,False
94453,"High altitude simulation test (HAST), with interpretation and report by a physician or other qualified health care professional; with supplemental oxygen titration",29.25,XXX,30/70,False,False,False,False,False
94610,Intrapulmonary surfactant administration by a physician or other qualified health care professional through endotracheal tube,17.59,XXX,,False,False,False,False,False
94617,"Exercise test for bronchospasm, including pre- and post-spirometry, electrocar- diographic recording(s), and pulse oximetry",18.47,XXX,35/65,False,False,False,False,False
94618,"Pulmonary stress testing (eg, 6-minute walk test), including measurement of heart rate, oximetry, and oxygen titration, when performed",32.38,XXX,20/80,False,False,False,False,False
94621,"Cardiopulmonary exercise testing, including measurements of minute ventilation, CO2 production, O2 uptake, and electrocardiographic recordings",38.05,XXX,20/80,False,False,False,False,False
94640,"Pressurized or nonpressurized inhalation treatment for acute airway obstruction for therapeutic purposes and/or for diagnostic purposes such as sputum induction with an aerosol generator, nebulizer, metered dose inhaler or intermittent positive pressure breathing (IPPB) device",3.55,XXX,,False,False,False,False,False
94642,Aerosol inhalation of pentamidine for pneumocystis carinii pneumonia treatment or prophylaxis,15.81,XXX,,False,False,False,False,False
94644,Continuous inhalation treatment with aerosol medication for acute airway obstruction; first hour,9.3,XXX,,False,False,False,False,False
94645,Continuous inhalation treatment with aerosol medication for acute airway obstruction; each additional hour (List separately in addition to code for primary procedure),3.55,XXX,,False,False,False,False,False
94660,"Continuous positive airway pressure ventilation (CPAP), initiation and manage- ment",19.45,XXX,,False,False,False,False,False
94662,"Continuous negative pressure ventilation (CNP), initiation and management",12.68,XXX,,False,False,False,False,False
94664,"Demonstration and/or evaluation of patient utilization of an aerosol generator, nebulizer, metered dose inhaler or IPPB device",4.23,XXX,,False,False,False,False,False
94667,"Manipulation chest wall, such as cupping, percussing, and vibration to facilitate lung function; initial demonstration and/or evaluation",5.07,XXX,,False,False,False,False,False
94668,"Manipulation chest wall, such as cupping, percussing, and vibration to facilitate lung function; subsequent",4.06,XXX,,False,False,False,False,False
94669,"Mechanical chest wall oscillation to facilitate lung function, per session",6.36,XXX,,False,False,False,False,False
94680,"Oxygen uptake, expired gas analysis; rest and exercise, direct, simple",13.53,XXX,40/60,False,False,False,False,False
94681,"Oxygen uptake, expired gas analysis; including CO2 output, percentage oxygen extracted",25.37,XXX,40/60,False,False,False,False,False
94690,"Oxygen uptake, expired gas analysis; rest, indirect (separate procedure)",5.07,XXX,40/60,False,False,False,False,False
94726,"Plethysmography for determination of lung volumes and, when performed, airway resistance",11.23,XXX,23/77,False,False,False,False,False
94727,"Gas dilution or washout for determination of lung volumes and, when performed, distribution of ventilation and closing volumes",8.81,XXX,29/71,False,False,False,False,False
94728,Airway resistance by impulse oscillometry,8.81,XXX,29/71,False,False,False,False,False
94729,"Diffusing capacity (eg, carbon monoxide, membrane) (List separately in addition to code for primary procedure)",11.16,ZZZ,15/85,False,False,False,False,False
94750,"Pulmonary compliance study (eg, plethysmography, volume and pressure mea- surements)",15.56,XXX,40/60,False,False,False,False,False
94760,Noninvasive ear or pulse oximetry for oxygen saturation; single determination,3.55,XXX,0/100,False,False,False,False,False
94761,"Noninvasive ear or pulse oximetry for oxygen saturation; multiple determinations (eg, during exercise)",5.92,XXX,0/100,False,False,False,False,False
94762,Noninvasive ear or pulse oximetry for oxygen saturation; by continuous overnight monitoring (separate procedure),7.44,XXX,0/100,False,False,False,False,False
94770,"Carbon dioxide, expired gas determination by infrared analyzer",10.15,XXX,40/60,False,False,False,False,False
94772,"Circadian respiratory pattern recording (pediatric pneumogram), 12-24 hour con- tinuous recording, infant",,XXX,40/60,False,False,False,False,True
94774,"Pediatric home apnea monitoring event recording including respiratory rate, pat- tern and heart rate per 30-day period of time; includes monitor attachment, down- load of data, review, interpretation, and preparation of a report by a physician or other qualified health care professional",,YYY,,False,False,False,False,True
94775,"Pediatric home apnea monitoring event recording including respiratory rate, pat- tern and heart rate per 30-day period of time; monitor attachment only (includes hook-up, initiation of recording and disconnection)",,YYY,,False,False,False,False,True
94776,"Pediatric home apnea monitoring event recording including respiratory rate, pat- tern and heart rate per 30-day period of time; monitoring, download of information, receipt of transmission(s) and analyses by computer only",,YYY,,False,False,False,False,True
94777,"Pediatric home apnea monitoring event recording including respiratory rate, pat- tern and heart rate per 30-day period of time; review, interpretation and prepara- tion of report only by a physician or other qualified health care professional",,YYY,,False,False,False,False,True
94780,"Car seat/bed testing for airway integrity, neonate, with continual nursing observa- tion and continuous recording of pulse oximetry, heart rate and respiratory rate, with interpretation and report; 60 minutes",10.59,XXX,,False,False,False,False,False
94781,"Car seat/bed testing for airway integrity, neonate, with continual nursing observa- tion and continuous recording of pulse oximetry, heart rate and respiratory rate, with interpretation and report; each additional full 30 minutes (List separately in addition to code for primary procedure)",4.12,ZZZ,,False,False,False,False,False
94799,Unlisted pulmonary service or procedure,,XXX,,False,False,False,False,True
95004,"Percutaneous tests (scratch, puncture, prick) with allergenic extracts, immediate type reaction, including test interpretation and report, specify number of tests",0.42,XXX,,False,False,False,False,False
95012,Nitric oxide expired gas determination,3.21,XXX,,False,False,False,False,False
95017,"Allergy testing, any combination of percutaneous (scratch, puncture, prick) and intracutaneous (intradermal), sequential and incremental, with venoms, immedi- ate type reaction, including test interpretation and report, specify number of tests",0.64,XXX,,False,False,False,False,False
95018,"Allergy testing, any combination of percutaneous (scratch, puncture, prick) and intracutaneous (intradermal), sequential and incremental, with drugs or biologi- cals, immediate type reaction, including test interpretation and report, specify number of tests",1.18,XXX,,False,False,False,False,False
95024,"Intracutaneous (intradermal) tests with allergenic extracts, immediate type reac- tion, including test interpretation and report, specify number of tests",0.72,XXX,,False,False,False,False,False
 95027,"Intracutaneous (intradermal) tests, sequential and incremental, with allergenic extracts for airborne allergens, immediate type reaction, including test interpreta- tion and report, specify number of tests",0.72,XXX,,False,False,False,False,False
95028,"Intracutaneous (intradermal) tests with allergenic extracts, delayed type reaction, including reading, specify number of tests",1.23,XXX,,False,False,False,False,False
95044,Patch or application test(s) (specify number of tests),1.65,XXX,,False,False,False,False,False
95052,Photo patch test(s) (specify number of tests),2.2,XXX,,False,False,False,False,False
95056,Photo tests,0.59,XXX,,False,False,False,False,False
95060,Ophthalmic mucous membrane tests,2.54,XXX,,False,False,False,False,False
95065,Direct nasal mucous membrane test,2.11,XXX,,False,False,False,False,False
95070,"Inhalation bronchial challenge testing (not including necessary pulmonary func- tion tests); with histamine, methacholine, or similar compounds",16.91,XXX,,False,False,False,False,False
95071,"Inhalation bronchial challenge testing (not including necessary pulmonary func- tion tests); with antigens or gases, specify",16.91,XXX,,False,False,False,False,False
 95076,"Ingestion challenge test (sequential and incremental ingestion of test items, eg, food, drug or other substance); initial 120 minutes of testing",23.19,XXX,,False,False,False,False,False
 + 95079,"Ingestion challenge test (sequential and incremental ingestion of test items, eg, food, drug or other substance); each additional 60 minutes of testing (List sepa- rately in addition to code for primary procedure)",16.28,ZZZ,,False,False,False,False,False
95115,Professional services for allergen immunotherapy not including provision of aller- genic extracts; single injection,1.35,XXX,,False,False,False,False,False
95117,Professional services for allergen immunotherapy not including provision of aller- genic extracts; 2 or more injections,2.03,XXX,,False,False,False,False,False
 95120,"Professional services for allergen immunotherapy in the office or institution of the prescribing physician or other qualified health care professional, including provi- sion of allergenic extract; single injection",1.86,XXX,,False,False,False,False,False
 95125,"Professional services for allergen immunotherapy in the office or institution of the prescribing physician or other qualified health care professional, including provi- sion of allergenic extract; 2 or more injections",2.28,XXX,,False,False,False,False,False
 95130,"Professional services for allergen immunotherapy in the office or institution of the prescribing physician or other qualified health care professional, including provi- sion of allergenic extract; single stinging insect venom",3.21,XXX,,False,False,False,False,False
 95131,"Professional services for allergen immunotherapy in the office or institution of the prescribing physician or other qualified health care professional, including provi- sion of allergenic extract; 2 stinging insect venoms",4.06,XXX,,False,False,False,False,False
 95132,"Professional services for allergen immunotherapy in the office or institution of the prescribing physician or other qualified health care professional, including provi- sion of allergenic extract; 3 stinging insect venoms",4.9,XXX,,False,False,False,False,False
 95133,"Professional services for allergen immunotherapy in the office or institution of the prescribing physician or other qualified health care professional, including provi- sion of allergenic extract; 4 stinging insect venoms",5.92,XXX,,False,False,False,False,False
 95134,"Professional services for allergen immunotherapy in the office or institution of the prescribing physician or other qualified health care professional, including provi- sion of allergenic extract; 5 stinging insect venoms",7.1,XXX,,False,False,False,False,False
95144,"Professional services for the supervision of preparation and provision of antigens for allergen immunotherapy, single dose vial(s) (specify number of vials)",4.9,XXX,,False,False,False,False,False
95145,Professional services for the supervision of preparation and provision of antigens for allergen immunotherapy (specify number of doses); single stinging insect venom,3.72,XXX,,False,False,False,False,False
95146,Professional services for the supervision of preparation and provision of antigens for allergen immunotherapy (specify number of doses); 2 single stinging insect venoms,4.57,XXX,,False,False,False,False,False
95147,Professional services for the supervision of preparation and provision of antigens for allergen immunotherapy (specify number of doses); 3 single stinging insect,5.41,XXX,,False,False,False,False,False
Professional services for the supervision of preparation and provision of antigens for allergen immunotherapy (specify number of doses); 4 single stinging insect venoms,6.43,,XXX,,False,False,False,False,False
Professional services for the supervision of preparation and provision of antigens for allergen immunotherapy (specify number of doses); 5 single stinging insect venoms,7.61,,XXX,,False,False,False,False,False
Professional services for the supervision of preparation and provision of antigens for allergen immunotherapy; single or multiple antigens (specify number of doses),2.70,,XXX,,False,False,False,False,False
Professional services for the supervision of preparation and provision of antigens for allergen immunotherapy; whole body extract of biting insect or other arthropod (specify number of doses),1.99,,XXX,,False,False,False,False,False
"Rapid desensitization procedure, each hour (eg, insulin, penicillin, equine serum)",18.26,,XXX,,False,False,False,False,False
Unlisted allergy/clinical immunologic service or procedure,BR,,XXX,,False,False,False,False,False
"Ambulatory continuous glucose monitoring of interstitial tissue fluid via a subcuta- neous sensor for a minimum of 72 hours; patient-provided equipment, sensor placement, hook-up, calibration of monitor, patient training, and printout of record- ing",10.67,,XXX,,False,False,False,False,False
"Ambulatory continuous glucose monitoring of interstitial tissue fluid via a subcuta- neous sensor for a minimum of 72 hours; physician or other qualified health care professional (office) provided equipment, sensor placement, hook-up, calibration of monitor, patient training, removal of sensor, and printout of recording",23.67,XXX,,0/100,False,False,False,False,False
"Ambulatory continuous glucose monitoring of interstitial tissue fluid via a subcuta- neous sensor for a minimum of 72 hours; analysis, interpretation and report",4.23,,XXX,,False,False,False,False,False
"Polysomnography; younger than 6 years, sleep staging with 4 or more additional parameters of sleep, attended by a technologist",177.79,,XXX,14/86,False,False,False,False,False
"Polysomnography; younger than 6 years, sleep staging with 4 or more additional parameters of sleep, with initiation of continuous positive airway pressure therapy or bi-level ventilation, attended by a technologist",189.62,,XXX,14/86,False,False,False,False,False
"Sleep study, unattended, simultaneous recording; heart rate, oxygen saturation, respiratory analysis (eg, by airflow or peripheral arterial tone), and sleep time",175.02,,XXX,31/69,False,False,False,False,False
"Sleep study, unattended, simultaneous recording; minimum of heart rate, oxygen saturation, and respiratory analysis (eg, by airflow or peripheral arterial tone)",296.09,,XXX,56/44,False,False,False,False,False
"Actigraphy testing, recording, analysis, interpretation, and report (minimum of 72 hours to 14 consecutive days of recording)",34.16,,XXX,27/73,False,False,False,False,False
"Multiple sleep latency or maintenance of wakefulness testing, recording, analysis and interpretation of physiological measurements of sleep during multiple trials to assess sleepiness",60.03,,XXX,40/60,False,False,False,False,False
"Sleep study, unattended, simultaneous recording of, heart rate, oxygen saturation, respiratory airflow, and respiratory effort (eg, thoracoabdominal movement)",67.64,,XXX,50/50,False,False,False,False,False
"Sleep study, simultaneous recording of ventilation, respiratory effort, ECG or heart rate, and oxygen saturation, attended by a technologist",84.89,,XXX,40/60,False,False,False,False,False
"Polysomnography; any age, sleep staging with 1-3 additional parameters of sleep, attended by a technologist",53.44,,XXX,40/60,False,False,False,False,False
"Polysomnography; age 6 years or older, sleep staging with 4 or more additional parameters of sleep, attended by a technologist",57.32,,XXX,40/60,False,False,False,False,False
"Polysomnography; age 6 years or older, sleep staging with 4 or more additional parameters of sleep, with initiation of continuous positive airway pressure therapy or bilevel ventilation, attended by a technologist",105.01,,XXX,40/60,False,False,False,False,False
Electroencephalogram (EEG) extended monitoring; 41-60 minutes,32.97,XXX,,40/60,False,False,False,False,False
Electroencephalogram (EEG) extended monitoring; greater than 1 hour,45.41,,XXX,40/60,False,False,False,False,False
Electroencephalogram (EEG); including recording awake and drowsy,26.38,,XXX,40/60,False,False,False,False,False
Electroencephalogram (EEG); including recording awake and asleep,26.38,,XXX,40/60,False,False,False,False,False
Electroencephalogram (EEG); recording in coma or sleep only,26.38,,XXX,40/60,False,False,False,False,False
Electroencephalogram (EEG); cerebral death evaluation only,37.50,,XXX,40/60,False,False,False,False,False
Electroencephalogram (EEG); all night recording,33.82,,XXX,40/60,False,False,False,False,False
Electrocorticogram at surgery (separate procedure),54.96,,XXX,95/05,False,False,False,False,False
95830,Insertion by physician or other qualified health care professional of sphenoidal electrodes for electroencephalographic (EEG) recording,19.62,XXX,,False,False,False,False,False
,"For codes 95831-95852, please see the Physical Medicine section.",,,,False,False,False,False,False
95857,Cholinesterase inhibitor challenge test for myasthenia gravis,10.99,XXX,,False,False,False,False,False
95860,Needle electromyography; 1 extremity with or without related paraspinal areas,21.98,XXX,80/20,False,False,False,False,False
95861,Needle electromyography; 2 extremities with or without related paraspinal areas,28.58,XXX,80/20,False,False,False,False,False
95863,Needle electromyography; 3 extremities with or without related paraspinal areas,37.20,XXX,80/20,False,False,False,False,False
95864,Needle electromyography; 4 extremities with or without related paraspinal areas,48.36,XXX,80/20,False,False,False,False,False
95865,Needle electromyography; larynx,32.97,XXX,75/25,False,False,False,False,False
95866,Needle electromyography; hemidiaphragm,22.83,XXX,90/10,False,False,False,False,False
95867,"Needle electromyography; cranial nerve supplied muscle(s), unilateral",22.83,XXX,80/20,False,False,False,False,False
95868,"Needle electromyography; cranial nerve supplied muscles, bilateral",39.91,XXX,80/20,False,False,False,False,False
95869,Needle electromyography; thoracic paraspinal muscles (excluding T1 or T12),16.91,XXX,80/20,False,False,False,False,False
95870,"Needle electromyography; limited study of muscles in 1 extremity or non-limb (axial) muscles (unilateral or bilateral), other than thoracic paraspinal, cranial nerve supplied muscles, or sphincters",16.91,XXX,80/20,False,False,False,False,False
95872,"Needle electromyography using single fiber electrode, with quantitative measure- ment of jitter, blocking and/or fiber density, any/all sites of each muscle studied",39.06,XXX,80/20,False,False,False,False,False
95873,Electrical stimulation for guidance in conjunction with chemodenervation (List separately in addition to code for primary procedure),9.13,ZZZ,71/29,False,False,False,False,False
95874,Needle electromyography for guidance in conjunction with chemodenervation (List separately in addition to code for primary procedure),9.30,ZZZ,72/28,False,False,False,False,False
95875,Ischemic limb exercise test with serial specimen(s) acquisition for muscle(s) metabolite(s),7.78,XXX,70/30,False,False,False,False,False
95885,"Needle electromyography, each extremity, with related paraspinal areas, when performed, done with nerve conduction, amplitude and latency/velocity study; lim- ited (List separately in addition to code for primary procedure)",11.66,ZZZ,32/68,False,False,False,False,False
95886,"Needle electromyography, each extremity, with related paraspinal areas, when performed, done with nerve conduction, amplitude and latency/velocity study; complete, five or more muscles studied, innervated by three or more nerves or four or more spinal levels (List separately in addition to code for primary proce- dure)",18.27,ZZZ,54/46,False,False,False,False,False
95887,"Needle electromyography, non-extremity (cranial nerve supplied or axial) mus- cle(s) done with nerve conduction, amplitude and latency/velocity study (List sep- arately in addition to code for primary procedure)",16.28,ZZZ,48/52,False,False,False,False,False
95905,"Motor and/or sensory nerve conduction, using preconfigured electrode array(s), amplitude and latency/velocity study, each limb, includes F-wave study when per- formed, with interpretation and report",24.52,XXX,4/96,False,False,False,False,False
95907,Nerve conduction studies; 1-2 studies,19.02,XXX,55/45,False,False,False,False,False
95908,Nerve conduction studies; 3-4 studies,24.63,XXX,54/46,False,False,False,False,False
95909,Nerve conduction studies; 5-6 studies,29.35,XXX,54/46,False,False,False,False,False
95910,Nerve conduction studies; 7-8 studies,38.65,XXX,54/46,False,False,False,False,False
95911,Nerve conduction studies; 9-10 studies,46.11,XXX,57/43,False,False,False,False,False
95912,Nerve conduction studies; 11-12 studies,51.17,XXX,61/39,False,False,False,False,False
95913,Nerve conduction studies; 13 or more studies,59.03,XXX,62/38,False,False,False,False,False
95921,"Testing of autonomic nervous system function; cardiovagal innervation (parasym- pathetic function), including 2 or more of the following: heart rate response to deep breathing with recorded R-R interval, Valsalva ratio, and 30:15 ratio",NC,XXX,53/47,False,False,False,False,False
95922 95923,"Testing of autonomic nervous system function; vasomotor adrenergic innervation (sympathetic adrenergic function), including beat-to-beat blood pressure and R-R interval changes during Valsalva maneuver and at least 5 minutes of passive tilt Testing of autonomic nervous system function; sudomotor, including 1 or more of",NC,XXX,45/55,False,False,False,False,False
,"the following: quantitative sudomotor axon reflex test (QSART), silastic sweat imprint, thermoregulatory sweat test, and changes in sympathetic skin potential",20.29,XXX,29/71,False,False,False,False,False
95924,Testing of autonomic nervous system function; combined parasympathetic and sympathetic adrenergic function testing with at least 5 minutes of passive tilt,29.35,XXX,59/41,False,False,False,False,False
95925,"Short-latency somatosensory evoked potential study, stimulation of any/all periph- eral nerves or skin sites, recording from the central nervous system; in upper limbs",35.76,XXX,80/20,False,False,False,False,False
95926,"Short-latency somatosensory evoked potential study, stimulation of any/all periph- eral nerves or skin sites, recording from the central nervous system; in lower limbs",35.76,XXX,80/20,False,False,False,False,False
95927,"Short-latency somatosensory evoked potential study, stimulation of any/all periph- eral nerves or skin sites, recording from the central nervous system; in the trunk or head",35.76,XXX,80/20,False,False,False,False,False
95928,Central motor evoked potential study (transcranial motor stimulation); upper limbs,92.67,XXX,50/50,False,False,False,False,False
95929,Central motor evoked potential study (transcranial motor stimulation); lower limbs,96.56,XXX,45/55,False,False,False,False,False
95930,"Visual evoked potential (VEP) checkerboard or flash testing, central nervous sys- tem except glaucoma, with interpretation and report",16.91,XXX,50/50,False,False,False,False,False
95933,"Orbicularis oculi (blink) reflex, by electrodiagnostic testing",14.37,XXX,80/20,False,False,False,False,False
95937,"Neuromuscular junction testing (repetitive stimulation, paired stimuli), each nerve, any 1 method",13.36,XXX,80/20,False,False,False,False,False
95938,"Short-latency somatosensory evoked potential study, stimulation of any/all periph- eral nerves or skin sites, recording from the central nervous system; in upper and lower limbs",61.77,XXX,15/85,False,False,False,False,False
