Code,,Description,Relative Value FUD,PC/TC Split
99510,"Home visit for individual, family, or marriage counseling",NC,XXX,
99511,Home visit for fecal impaction management and enema administration,NC,XXX,
99512,Home visit for hemodialysis,NC,XXX,
99600,Unlisted home visit service or procedure,NC,XXX,
99601,"Home infusion/specialty drug administration, per visit (up to 2 hours);",NC,XXX,
99602,"Home infusion/specialty drug administration, per visit (up to 2 hours); each addi- tional hour (List separately in addition to code for primary procedure)",NC,XXX,
99605,"Medication therapy management service(s) provided by a pharmacist, individual, face-to-face with patient, with assessment and intervention if provided; initial 15 minutes, new patient",BR,XXX,
99606,"Medication therapy management service(s) provided by a pharmacist, individual, face-to-face with patient, with assessment and intervention if provided; initial 15 minutes, established patient",BR,XXX,
99607,"Medication therapy management service(s) provided by a pharmacist, individual, face-to-face with patient, with assessment and intervention if provided; each additional 15 minutes (List separately in addition to code for primary service)",BR,XXX,
